title,body,rating,review_id,sentiment_label,sentiment_score,positive_score,neutral_score,negative_score,compound_score,topic_id,review_length,is_negative,is_positive
"It’s a mixed bag, but overall disappointing","I started with one fire stick in my bedroom and the more I used it the more I liked it. In fact I liked it so much that I talked my wife into cutting the cord (satellite) after 15 years. I was tired of paying for hundreds of channels that I NEVER watched.We ordered two more fire sticks for the house and a fire tv recast with an indoor antenna. I started noticing reception and system problems and associated it with the antenna so I ordered an rooftop antenna.Unfortunately, the problems persisted. While using this setup as a primary system it becomes glitchy. It constantly pauses with the three pulsating dots while watching live TV or recorded content from the recast. There are times when the system is unresponsive. There are times when you want to watch a channel, but it won’t tune (three pulsating dots), but other channels are fine. Watching football can be very frustrating when the stream hangs and then jumps to live and you’ve missed and entire play.All in all, I wish I would have just stuck with Directv and used the fire stick for watching movies or shows before bed. By the time I bought access for the content I wanted I didn’t save that much (maybe $30 per month), but the frustrations are mounting and I’m leaning towards cutting my losses on investing in this (>$300) and going back to directv anyway. At least with Directv I’m only frustrated with occasional disputes leading to channel outages and storms. With this system my wife and I get frustrated daily even with amazing content.",3,118,positive,0.5018973350524902,0.5018973350524902,0.3656727969646454,0.13242988288402557,0.3695,0,1510,0,1
Not Aging Well...,"This is a big device in a small package. With a strong wifi connection, you can stream flawlessly and get all your services in one easy to use home page. My only issue comes with the occasional Netflix service issues but I attribute that more to my wifi signal and only on my second floor through several walls.I own three Fire Sticks. The first is used on an older 720p TV in a bedroom that isn't compatible with apps. The second is a primary TV that's only about five years old but refuses to download certain apps like Disney+. The Fire Stick solved both problems. We recently dropped the wallet draining ""triple play package"" from Comcast and now rely solely on a high speed 1G Verizon Internet connection. The Fire Stick has replaced our old programming and we don't miss the 800+ channels of which we watched maybe five of them. Granted you need streaming service provider contracts but it's still cheaper. The Fire Stick is an easy to use device bringing all the services together in an aesthetically pleasing and user friendly way. I recommend it and probably even if you have a newer TV. I doubt its app formatting is as good. There's no monthly payment for the Fire Stick itself so it's still worth it.Update: One of my Fire Sticks updated with new software while the others wont do the same. Even with the update, I find it's not even close to being as convenient as the Chromecast device I recently bought. Amazon needs to improve the software and upgrade the memory and remote features.",3,119,positive,0.7346904873847961,0.7346904873847961,0.24759872257709503,0.017710726708173752,0.717,6,1499,0,1
"Covers all the streaming basics, but very slow performance.","For the price this is a pretty OK streaming stick. All of the major streaming services are supported like Netflix, Prime Video (of course), YouTube, Hulu, etc. The device is easy to set up and takes up no shelf space since it is a small dongle you plug into the back of your TV. The remote works fine, and the latest version with volume and power control is great if you don't use other streaming devices or cable boxes on your TV as you can control most main TV functions with the one remote.The two main negatives I have with the Fire Stick is that it is VERY SLOW. It can take MINUTES for the interface to load with all of your app/movie tiles just so you can launch Netflix. It gets worse as you install more apps which brings me to the second problem: Lack of on-board storage.Of the advertised 8GB of storage space, the Fire Stick already has around 5GB taken up by the operating system and Amazon apps you can't delete like Amazon Photos. Since every feature is an app that requires installation this becomes a problem if you like to use a lot of different streaming services. Beyond that, the RAM on this thing is tiny and it appears to use storage space to offset the limited RAM so if you have more apps installed the performance of the stick degrades significantly.16GB should be the minimum amount of storage these things come with and 32 wouldn't be a stretch. Amazon sells a 32GB SD card for $6 so including that much storage wouldn't hurt the price of these that much.",3,120,positive,0.8815613389015198,0.8815613389015198,0.11291559785604477,0.005523041822016239,0.876,0,1483,0,1
It is slightly better and cheaper than equivalent Roku,"I have Sling TV and several separate premium channel streams. This is maybe a review more of the channels and streaming than just the device. I also own some recent Roku devices as well to compare.Crunchyroll ad version for example and a few others will crash/corrupt in the middle of 'ad packs' at the same place consistently. This ruins the channel/app for at least the day. Roku channels don't seem to do ad packs for apps and so are immune. Late night streams weirdly crash more often for fire sticks as well. Sling TV's app quality isn't great and crashes at least once a day, but even the HBO app crashes once in a while. The Roku versions are a little more crashy and often triggers a watchdog full reboot while the Fire will come back to its menu instantly.The implementation of the apps UI is better than Roku. However, it seems that Amazon really wants users to search by Alexa instead of by text which makes a poor user experience when guessing titles.The hardware design is weird as it has to be very near the HDMI connection which makes supplying power harder. The device appears mostly responsive to the remote, much more than the Roku (both will be 'busy' and ignore remote commands once in a while). Overall it is good value as a streaming device and a better deal than the Roku equivalent. I hope Roku improves their hardware at similar price and capability points. Both need to improve codec error handling and remote responsiveness.",3,121,neutral,0.6100537776947021,0.04025844484567642,0.6100537776947021,0.3496878147125244,-0.3094,1,1451,0,0
AMAZON CUSTOMER SUPPORT,"So I was to get TWO products the firestick and another product I got my firestick and I like it no issues yet like I said I just got it but I have a complaint for AMAZON I HAVEN'T GOT MY SECOND ORDER SO I CALLED AMAZON GOT A gentleman I told him my issues stated that I was supposed to get my product today the same time I had got my fire stick he said okay let me see what's going on he says I do show IT in the system we don't know why you did not get your second item let me place you on hold, so I was on hold with Amazon 1 hour and 20 minutes no check-in not tell me what was going on just had me on hold I would get 30 seconds of music and then 30 seconds of silence 30 seconds of music 30 second of silence in this repeated on constantly for an hour and 20 minutes so I had to hang up with that person call them back. A nice and lady was assisted me and told me what was going on with my product saying it will be here Friday but my complaint with Amazon is this I was never given anything for my waste of time on the phone for an hour and 20 minutes it makes it really hard to keep Amazon prime when their service is so crappy like this I am going to delete my prime account because this makes no sense you do not keep a customer on hold for hour and 20 minutes and do not check in that is my complaint with Amazon as far as my fire stick I do like it I've only had it less than 24 hours there are no issues with my firestick as of yet if there is I will then make another review.",3,122,positive,0.6420505046844482,0.6420505046844482,0.2954045534133911,0.06254493445158005,0.5795,0,1488,0,1
Pass if you have a choice,"I got this as a prime day special to simply play with. It was $15 and then I had some discounts laying around so I basically got it free. I plan on using this on my next TV that I will add for my basement. Typically I use ROKU devices on all of my TV's.Pros and Cons....Pros:The Amazon Prime environment that is baked in is very good. The ability to use Prime Photos and do slideshows is probably it's best feature. You can also play some basic games, from the amazon app store like Crossy Road, etc. and they run just ""ok"". Kind of neat to play those kind of games on TV in a pinch if you're bored.Cons:The most important part, the apps and speed of streaming, by comparing this to a similar model Roku TV Stick, the Roku absolutely runs circles around the Fire Stick. The Roku is much faster to navigate, much much cleaner interface layout and the buffering of playing videos from any APP is much faster on the Roku. The Fire Stick I initially thought was just incapable of HD however I then realized it has an incredibly slow buffer, after about a minute or two of playing the video would finally clear up, which, if you use HULU with Live TV some something similar then that is not acceptable. My wireless and bandwidth speeds are not the issue either, both are very fast. Given those shortcomings, the price when on sale (prime day, black friday, cyber monday) is hard to beat, but if you're on the fence, go with the Roku.",3,123,positive,0.7420690059661865,0.7420690059661865,0.25134778022766113,0.0065831756219267845,0.7355,0,1428,0,1
Meh...Roku still better,"I've purchased a few of these around the home to replace some aging Roku's. Initially, I was impressed with the ease of setup and the integrated remote to control my television and soundbar with the single remote. This is where my love affair ended unfortunately. After several months of consistent usage, we have issues on a daily basis. We are complete cord cutters and the stick seems like it's too underpowered to handle the streaming apps we use. Sling crashes at least once a day, Prime video w/HBO is hit or miss and the Alexa integration is pretty useless. It appears that as you open different apps on the device, the apps continue to run in the background as you navigate to other apps. You can see how after watching a show on Sling, then moving to Netflix, then Hulu and then Prime how this could be a potential problem. There doesn't appear to be a way close the apps out without actually restarting the stick manually. If these issues were relegated to a single stick I would certainly chalk it up to a corrupted device but all of them do this.Unfortunately, I've had to dust off the old Roku's, install and update them but the thing is they just work. Even as old as they are, they may be a bit slow but the apps work and they never crash which leads me to believe that the latest Roku's are that much better. I had higher expectations from the Fire Stick but in the end, the convenience of the single remote and ease of setup is not enough to keep me in fold.",3,124,neutral,0.5485442876815796,0.2435619831085205,0.5485442876815796,0.2078937590122223,0.0357,0,1475,0,0
FYI - Alexa / Voice Recognition DOES NOT WORK,"The fire stick is slow to load when you first turn it or or switch to an app, but once you get it going its fine. Unfortunately some of the features don't work. At all. Ever. And most of the settings aren't ""settings"" that you can alter - they're just informational things. So its a problem when something isn't working. Like Alexa / Voice recognition. There is a small number of ""Help"" videos - none of them has ever addressed a problem I've had.Alexa / Voice recognition doesn't work for me. At all. Never has. I've reset the device by holding the home button. I've re-paired the remote. I've tried speaking loudy, slowly. I've tried every combination of button adn blue light. Nothing. Have I missed a step? I don't know. There aren't any instructions anywhere. This fact alone make me even more sure that mine JUST DOESNT WORK. There seem to be two camps. For one group it works perfectly with nearly zero effort. And then there is my group who get no results despite trying everything and scouring the internet for tips.I've also never had luck using the apps that lets you mirror or project your laptop or phone screen onto the TV via the firestick. So that another ""feature"" that has literally never, ever worked.The firestick works for streaming amazon prime - and other streaming services. But several of the other features touted by amazon simply don't. Its disappointing.",3,125,negative,0.8763371109962463,0.011727015487849712,0.11193595826625824,0.8763371109962463,-0.8646,0,1382,1,0
Maybe I'm just old school...,"I agree about the set up and what the Fire Stick has to offer. Being an old school guy and not really into all the modern technology, I was surprised how fast I had this up and running. There is a learning curve to navigating through the different screens. My only issue was that the Fire remote will not turn off my TV. I can turn it on and do everything it's required to do, it just will not turn my TV off, I have to use the TV's original remote for that.I contacted Amazon support and spent way too much time with no positive result. The support Tech even had me hook up an Echo Dot I received from Amazon not to long ago. It was free from some other purchase so I did it. Folks...I'm not a fan of Alexa, the last thing I need is to have to talk to my TV. The Echo Dot did not fix my problems. Alexa could not turn the TV on or off, it kept telling me about some issue with why it wouldn't work that the support tech had no idea of. When a piece of equipment starts asking me questions and keeps repeating itself, it's time to call it quits. I was disappointed that a TV that is less than 6 months old isn't compatible with the remote. Two different support techs and over an hour of phone time didn't fix the remote issue. This includes a new second remote Amazon sent. Amazon tried to work out the bug but no luck. Over all I can live with the turning off issue but you all can have Alexa and it's eavesdropping capabilities.",3,126,positive,0.6510900855064392,0.6510900855064392,0.30493563413619995,0.043974339962005615,0.6071,4,1431,0,1
No Alexa integration through AV receiver; Beware of unintentional ording of programming,"I do not have any other Alexa devices. I connected the FireStick into an HDMI port on my AV receiver and then connected it to my home WiFi network. The FireStick/Alexa cannot change the AV receiver's HDMI inputs to choose the correct HDMI port for the FireStick (I have to do that through the AV receiver's remote) and while the sound for the programming through the FireStick does play properly through the AV receiver, Alexa cannot be contacted and does not reply. Basically, Alexa is completely non-existent when using the FireStick through my AV receiver. I searched through many options, settings and the help system and have been unable to find a solution.Streaming quality is good. A large selection of choices, but one must be VERY careful when perusing the programming selections as one can get charged for ordering something for additional cost without meaning to. There do not seem to be any popups asking you to confirm a purchase. Somehow I accidentally ordered PGA Live or some such nonsense at $9.95/month without knowing simply by hitting the wrong button at the wrong time. I canceled it the next day when I saw the email notification and charge, but haven't seen it credited back after two weeks. A popup saying ""You are about to order XXXX. Do you want to continue"" would be a good customer practice.Overall it is a passable, but not perfect, solution for additional programming.",3,127,neutral,0.5212670564651489,0.025516953319311142,0.5212670564651489,0.453216016292572,-0.4277,1,1398,0,0
There are kinks...,"This gets mixed reviews from me. I was using another device to stream Amazon Prime on my television and received notification that Amazon was no longer going to allow it after the end of September so I basically had no choice but to get the fire stick. I never had an issue with that device but I can't say the same about the fire stick. When switching the TV input on my television between cable and the fire stick, the screen often remains black. I then have to play with the buttons on the fire remote to get it to turn on. There is no ON/OFF light indicator so it is impossible to know if it is on or off and to make matters worse, there is a delay so did I just turn it on or off? Who knows. One time it refused to turn on at all and I had to unplug and replug the stick into the tv itself. (I've only had it about a month.) Unplug the cord. Take out the batteries from the remote and put them back in. Have no idea why it wasn't working but after 20 frustrating minutes it turned back on so great. Which leads me to another issue - WHY did they design the remote so opening the back to put in & replace the batteries is such a chore?? It is like a puzzle box. The last issue is with the voice control. I tried to use it but our echo dot responded - from another room where my kid was sleeping. Not helpful. I didn't realize the voice control has to work through an echo device, I assumed it was independent.",3,128,negative,0.5094110369682312,0.03813514485955238,0.45245376229286194,0.5094110369682312,-0.4713,0,1413,1,0
Ok for the price. Not great.,"I already have a Apple TV in my living room and wanted a streaming box for my bedroom. I decided to save some money and get the fire stick which was more than a hundred dollars cheaper. I have to say I was disappointed in the fire stick.Pros:Very low price.Has a decent amount of apps (Not as many as Apple).Alexa integration if you need that. (I don’t use it)Cons:Clunky operating system.Hard to find apps you purchased.Several Amazon apps preloaded and cant be deleted.Amazon apps displayed first.No way to rearrange apps to your preference.Apps continually log out requiring you to go online and reactivate over and over again.Apps clunky compared to Apple TV.Have to constantly restart apps and device due to freezing.WI-FI only. No option for wired connection.If you don’t have blazing wi-fi, expect the dreaded buffering spinning ball often.If you are looking for a ridiculously low priced streaming box with Amazon prime and Alexa integration, and you have fast wi-fi, or are ok with buffering, and don’t mind having to work a little to get the box to work, then the fire stick is for you.As for me, the fire stick has been ok for awhile, but I think I’m going to go ahead and spend the extra money and get another Apple TV. You get what you pay for.",3,129,negative,0.4999057948589325,0.1121915802359581,0.3879026174545288,0.4999057948589325,-0.3877,0,1257,1,0
Smart but no Genius,"I bought this Fire TV Stick to enhance the failing IQ of an aging Samsung Smart TV. It has been useful and is easy to use, although I don’t use the Alexa voice command functions. It has not been very useful, though, at integrated my Apple TV subscription or my Peacock TV subscription, and I have been unable to find much help with my issues. It was easy enough to download the AppleTV app, but it keeps giving me messages that in-app purchases are not allowed whenever I try to watch anything. In short, it does not seem to recognize that I have an AppleTV subscription. I can start something on my tablet and then watch on my television, but that’s a step that should be unnecessary. There is no log-in function in the Amazon AppleTV app of the sort you find with Netflix, which could mitigate the problem. I have been unable to even find NBC’s new Peacock TV streaming service. It was a modest investment, and for watching Amazon Video, Netflix, and a few other streaming service I use, it has been useful. I figure updates will be timely and seamless, so I am not dissatisfied, just somewhat disappointed, especially at the difficulty in finding documentation or support. (I finally found advice to call for support, but after having spent way too much time with automated voice systems, I didn’t call. I should be able to find written instructions, or engage in a live chat.)",3,130,positive,0.45262864232063293,0.45262864232063293,0.4164370000362396,0.1309344321489334,0.3217,4,1380,0,1
Don’t buy if you want to use it with your echo dot,"Alexa never had trouble with my FireTV Edition Insignia TV, but God forbid I try to do anything with this Firestick (which I bought when my TV screen went black after an update to Amazon software, costing me already ($250). I already blame amazon for that.Instead of playing things on Hulu when I tell it to play whatever, it just searches for it and pulls it up. Doesn’t play it “here’s what I found). It will not sync with Alexa Dot to turn my tv on and off, volume control, or anything else that is helpful that I grew accustomed to.So to recap, my TV crapped out before a year passed by when I updated Amazon software (unfortunately I bought it at Best Buy and lost my receipt and they can’t find it by serial number because with all their technology, they don’t use it to benefit customers), I can barely use my Dot to control it, which is the majority of the reason I use amazon products in the first place. I would not recommend this device to anyone.Oh- and don’t even bother with screensaver settings because it basically turns the screen black all of 30 seconds after it starts no matter how long or what you do with the settings.I would not recommend this product without significant improvements. Also, the cost to replace the remote shouldn’t be almost the same as the entire device. That’s just ridiculous.",3,131,negative,0.836700439453125,0.017165185883641243,0.1461343914270401,0.836700439453125,-0.8195,0,1320,1,0
Started great,"We got a fire stick just because it was a good deal and wanted to test it. It works great! Sometimes there may be a slight streaming issue, but it's only happened twice, and for only a few seconds. What we really like it the overwhelming amount of content. We thought there would be limited options, but there is always something to watch for free (even moreso with Prime). Our little one found a favorite with Dino Dana on Prime, and it's been a great find to increase her dinosaur love. Overall good product. We don't use voice recognition that often so can't really rate that. It's worth owning one, especially if you find a good deal. Ours was $24 I think? Worth every penny.Edit 8 months later: Not sure what happened, but the fire stick seems barley usable now. Nothing has changed with our setup, but after streaming for about 5-10 ""slow internet connection"" pops up and can't watch anything. In settings it shows our connection is good and strength good. Tried at different times of day and Everytime same thing. Even deleted apps and clear caches, but still problem persists. This has gone beyond annoyance to a severely bad problem. If we can't stream something what's the point of using? I had to drop my review considerably due to instances. Are there any suggestions to make this thing function as intended now?",3,132,positive,0.9568648338317871,0.9568648338317871,0.03509954735636711,0.008035692386329174,0.9488,0,1324,0,1
Overheats all the time !!!,"At $30, the firetv stick packs a tons of features and it is really easy to install/use. My biggest issue is with the device overheating ALL THE TIME !! It overheated within 15 mins of my first use, and has since been struggling to maintain at a reasonable/operational temperature. My cabinet is designed to house all my media/entertainment needs - it has cable TV box, Blu-ray player, PS4 consoles, WiFi hub, charging stations for laptop/phones etc. None of these other devices has ever experienced any overheating or air flow issue, until the firetv stick arrived. For a product that sells millions in qty and is designed by a huge corporation, I am baffled by how the firetv design got approved with such a constant and obvious issue. Just look up the website to see how many customers/users are experiencing this. If you want to have a smooth operation of this firetv stick, be prepared to invest another $15-$20 on some heat removal solutions (addition of heat sink or heat fins, plus a small fan or blower) to increase the air flow and heat dissipation ability around the firetv stick. I would have gladly paid $50 for a firetv stick that is designed with a better cooling solution and works well from the get-go, instead of $30 for a device which I then have to add some must-have accessories to make it work properly.",3,133,positive,0.6580752730369568,0.6580752730369568,0.2508043050765991,0.0911204069852829,0.567,2,1324,0,1
