title,body,rating,review_id,sentiment_label,sentiment_score,positive_score,neutral_score,negative_score,compound_score,topic_id,review_length,is_negative,is_positive
Fire TV Stick Gen 1 versus Gen 2,"I purchased my Fire TV Stick Gen 1 the day it was available at a national retailer (initials are BB) a day or two before Amazon offered it online. The coroner does not know why my Gen 1 finally died after only six years: may it rest in peace.My Gen 2 replacement arrived today (3/24/20). Opening the battery cover was very difficult. Once off and back on, it almost feels too loose. The corners of the remote need better finishing: they are a bit scratchy at the edges compared to Gen 1. The on-screen choices look different and there is a little learning curve to get used to it.On/off button: if it times out after non-use, who needs an ?Volume control: I like it; much handier than simultaneously using my TV remote and Fire Stick.Mute: useless: click the main button to stop; then you won't go back for whatever you missed.I am still glad I have Amazon Prime, but the viewing selection is a bit limited and I do not want to binge watch subscription channels on trial basis to get the series I want to watch. I can only afford one plan and will not purchase Netflix, CBS, Disney,or any of the others.Bottom line: though I can watch Prime all day on my 21"" PC, I like to relax with a slightly larger screen and bought the Gen 2 replacement stick. I will end up liking it as much as the old Gen 1.Oddly enough, right now a Gen 1 replacement remote (NO STICK) is $27.99. The newer Gen 2 remote WITH A STICK is $22.99 as a Prime member ($39.99 w/o Prime). Join Prime before you buy!",4,175,negative,0.5691947937011719,0.03529936447739601,0.3955058157444,0.5691947937011719,-0.5339,6,1481,1,0
"Occasional buffering problems, but a nice unit.","I bought this FireTV stick as the first step in cutting the chord to DirecTV (We also finally killed our landline which was only good for spam calls!). We'd been paying for the top package for about 8 years, which crept up from the promo of $59.99 to the current $166.99 per month. While you get all the movie channels, we typically only watch original programming on HBO, Showtime, and Starz, and so we were paying a lot of money for services we don't use. Because I need DIRECTV for the NFL Sunday ticket package (they have exclusive rights, although I am hopeful the league will sell it to a cable provider during the next negotiation in a couple of years), I dropped my subscription to the 2nd lowest level (need ESPN for the Monday night games), which knocked almost $100 bucks off my monthly cost. I still get local channels as well.I paid $35 for the FireTV stick on sale, and now subscribe a la carte to HBO NOW ($15/mo.) and showtime ($12/mo.). My experience has generally been positive, but despite having gigabit internet, I'm still getting occasional buffering problems. This is unusual, as the TV it's connected to has Netflix and Amazon Prime Video apps that rarely have buffering issues. (I had to buy the FireTV stick because my TV is 7 years old, and could not be updated for the HBO/Showtime apps). One time, rebooting the firestick worked to resolve the issue, and one time I rebooted the router. I'll update this review if it continues to be an issue, but thus far am satisfied with the unit and with the cost savings.",4,176,neutral,0.4439535439014435,0.2736208140850067,0.4439535439014435,0.2824256420135498,-0.0088,0,1538,0,0
Do NOT need to use the voice activation,"First, I want to make clear that you do NOT need to use Alexa to operate this device. It comes with a remote that you can use and NEVER have to deal with that creepy thing if you don't want to.I know some people love this voice activated stuff but I'm not one of them. I prefer using a remote so I can lose it and howl in fury as I tear the place apart searching for it.I bought this as a gift and the recipient refused to use it, believing, as I did, that the ONLY way to operate this was with Alexa. Neither of us wanted Alexa on our premises so this device sat in my closet, unopened for over a year, until today. I decided to pull it out and test it. I was delighted to find out that Alexa is an OPTION that one can simply IGNORE so I did.While I have set the device up with various shows and my Amazon account, it will probably be another few days before I actually watch it because I just don't watch that much TV. But it has the Amazon music (which I listen to all of the time) and also now podcasts (that's the reason I decided to give it a try - to listen to podcasts).It was very easy to set up my other accounts. I had no issues with the set up out of the box, enabling the Wifi, finding movies and TV shows, setting up other accounts and synching them. It was very simple and very easy. No problems at all.This is great for someone who wants to ""cut the cord"" and give up cable and/or satellite but still enjoy a variety of movies and shows at a fraction of the cost.",4,177,negative,0.5979917049407959,0.0536007285118103,0.3484075665473938,0.5979917049407959,-0.5444,0,1479,1,0
Easy and it works (2nd Generation released in late 2019),"After doing some research, I chose the Fire Stick so that I could ""cut"" the cable cord. So far, I am very pleased with how easy it was to set up and how well it is performing. I have a 2013 vintage Samsung 37-inch LED TV. It has two HDMI ports, but only one works with the Fire Stick (the one labelled HDMI/DVI). It so happens that this port is the only one of the two that works with my Blu ray player, but that is not an issue. I was already subscribed to Netflix and this was easy to download to the Fire Stick. I added a subscription to YouTube TV to replace my cable stations (including my local stations and PBS) and that is working fine at less than half the price of my former cable subscription, with stations I could not receive before ($53 vs. $109). All of the FREE apps for Tubi, Pluto, Crackle , IMdb and more are available and easy to download. The aforementioned DO NOT require a paid subscription. Also, I have a dual-band router from Frontier for Internet service. The Fire Stick automatically selected the 5 GHz channel and again, is running very well. Based on all of this, I would highly recommend the Fire Stick to those looking to ""cut"" the cord. There is so much FREE content that becomes available that you may not need to subscribe to YouTube TV, Netflix or similar services. One last thing. I did nothing special to activate Alexa. It was transparent! I recently added a male-female HDMI cable so the Fire Stick and Wi-Fi extender are not hanging from the back of the TV.",4,178,positive,0.9208509922027588,0.9208509922027588,0.07426471263170242,0.004884346853941679,0.916,1,1498,0,1
Great Device but there is definitely a Learning Curve Especially If You are Not Tech Savy,"It seems simple enough but there are lots of ""moving parts."" Part of the process was very easy like the fire stick recognizing my wireless network so i did not need to enter that data. Without any instruction it recognized the TV's and can turn them on and off as well as adjust the volume. Then there are issues like sometimes i can delete an unwanted app and sometimes i cannot. Sometimes a program plays full screen and sometimes not. Sometimes a program plays and streams fine and sometimes the system asks me to sign up for a free trial for a program i already have as part of my service. Often it is difficult to tell if the issues are me or the system. Overall i am very pleased i made the switch to the fire stick from an old Sony DVD player that also streams. Amazon will not longer be supporting that device and at first that was disappointing but the $40 fire stick was only $15 with the discount because of no longer offering support. Once i figured out more how the remote worked (and i am still discovering features), I am liking it more and more and actually plan to buy another for one of the other TV's in my home. Finally, because of this process i am also ready to drop cable and signup for a live TV streaming service. I would not have pursued that is Amazon had not ""forced"" me into a fire stick. Some times the ""world"" whacks you and often as a result of the whack things get better. That is how i see this somewhat frustrating learning process ;)",4,179,neutral,0.6315978169441223,0.30769163370132446,0.6315978169441223,0.06071056053042412,0.247,3,1469,0,0
An absolute lifesaver!,"I bought this item as an alternative to our lousy Roku system. My husband gifted me with a subscription to Acorn TV (because I LOVE British mysteries!) at Christmas. After the 7 day ""free trial"" he tried for two weeks straight to ""renew"" the subscription through Roku. NOTHING he did worked and it is IMPOSSIBLE to reach a living human being to get some answers or assistance. Thus my Fire Stick purchase. Set up was super easy, and when the ""free trial"" ended, the subscription continued (as it was supposed to) and my credit card was charged ALL without no interruption to my Acorn service. The only thing I wasn't happy about was the fact that I had a credit balance on my Amazon account & I wished it had charged the subscription against that instead of my credit card, but in comparison to all my other issues, that was a minor inconvenience. I understand that you are supposed to be able to change the billing preference under settings, but when I attempted to do so, all it would offer was for me to replace one credit card with another - the option to deduct the monthly charge from my credit balance wasn't an option. Amazon could learn from Apple in that regard. As long as I keep a credit balance on my Apple account, all my monthly subscriptions will deduct themselves from the credit balance before assessing themselves against a credit card. However, all in all, I'm THRILLED that I can continue watching my Acorn TV.",4,180,negative,0.6186853647232056,0.08024989813566208,0.30106475949287415,0.6186853647232056,-0.5384,7,1431,1,0
Ease of installation,"I decided against tolerating the abysmal customer service attitude of Roku any longer and switch to an optional streamer. The FireStick coincidentally was offered at a discount and, coupled with reviews I read, I purchased it. It arrived just yesterday, very cleverly and ingeniously packaged by the way, though disappointed, again, to discover it's made in China. What do we have to buy that ISN'T anymore? After reading the sketchy instructions provided, and examining the components, I set about connecting it. All together, I estimate it took fewer than five minutes, start to finish, to get it configured, registered, and working. Thus far, I'm very pleased with it, though it's channel selection procedures are not as intuitive, nor as straightforward, as Roku's, nor, evidently, is the extent of choices. But that ought to improve with experience. As others have reported, Amazon is shameless in its relentless self-promotion and, frankly, it's not merely annoying, it's an assault. I chose NOT to use Alexa, as it might be convenient, it's untrustworthy, what with many reports of its ""spying"" activities. I prefer to push the buttons! Overall, a good choice. As a p.s., I would caution against buying Roku, though it might well be the best among the several stream devices, because, as I said, problems go unacknowledged and customer service is anything but. Amazon, in this case, the lesser of two evils.",4,181,neutral,0.4233222007751465,0.2633589506149292,0.4233222007751465,0.3133188486099243,-0.05,0,1414,0,0
"CBS All Access errors, second gen stick","I mainly purchased the stick to start off watching shows on CBS All Access. The CSB app on this devise works with Prime. I simply had to download the CBS app to use without Prime. While watching show on All Access I started getting error messages (UVP-1001 and UVP-1011) as the next show was loading and could not watch the show on my tv. I did try two other options. I was able to watch the next episode on my computer and Xbox. Then I could go back and watch some more on my Stick. But the error would come up again between episodes. I also unplugged the Stick once and then was able to watch an episode that previously showed an error message.So this leaves me to believe that the problem is with the Stick while viewing All Access via CBS's app and not the app that is pre installed to work with Prime only. Having to unplug the Stick all the time or gathering around the laptop is not a good option.Other than that the Stick has worked well. I do have it connected with the available Ethernet adapter on DSL. Usually just a few seconds to buffer and shows and movies start quickly.I tried the Alexa and it made me feel like I was Mr. Scott sitting at a computer talking into a mouse.And for those that want free movies and shows, there are apps that can be installed that state free TV. One already installed is IMDB TV. Free shows and movies with commercials.",4,182,neutral,0.8242639303207397,0.07710741460323334,0.8242639303207397,0.09862872958183289,-0.0215,3,1365,0,0
Doesn’t last long.,"I’ve had many fire sticks since they have came out with them. I love it for the most part because I have everything that I could possibly want to watch right there. I can move from my bedroom to the living room and pick up right where I left off on the same movie. I bought them for my parents and they love it too. But the flaw is that I’ve never had a fire stick last for more then a year/ year and a half without starting to have problems. My first fire stick which was one of the original ones worked great and then it started to get slower and slower, the remote stoped working. So I had to use my phone as a remote on the app and then my phone wouldn’t connect so I had to use my Alexa dot to control it. To replace the remote it cost practically as much as a new fire stick. It was out of warranty so I couldn’t have it replaced and the new fire stick came out so I just thought oh I will buy a new one and I did. I love it a lot but now getting my Alexa to control it is very difficult it took me three/ times to get it to connect properly.While these are all minor things it’s just something to think about when buying these. They are relatively inexpensive and amazon usually does really good deals around the holidays to get them cheaper. But I just wish they lasted a little bit longer so I don’t have to keep replacing them all the time.",4,183,positive,0.9536339640617371,0.9536339640617371,0.03879181295633316,0.007574170827865601,0.9461,3,1350,0,1
Compatability issues update,"I was very excited about the opportunity to make my older HD television more functional and not have to buy a new smart TV. After enjoying my Fire Stick for a week my television began to malfunction. It started to automatically switch on and off in random short cycles. I thought my old TV had just wore out because the symptoms were similar to when capacitors go out. Well before just tossing it out, I had to experiment. After a few hours of trying different things I discovered that did I not only have to remove the Fire Stick, but had to take it to an entirely different room of the house. This just happened last night so I have much more research to do and am hopeful the unit will work on a different TV in my house, but since I was prompted for a review just now, well, just bad timing I guess.Update:Having not identified the exact cause of my problem I decided to recreate the original setup and do some more checking. I have not been able to locate the problem so far because over nearly one month I have had no problems whatsoever. Sorry, I can't tell you what the the problem was. Maybe I just wasn'tholding my mouth right. I don't know. But, now that it is working, I can report that the Fire Stick is an amazing piece of technology and, with the savings on my entertainment bill, is probably one of the best investments I have made.",4,184,positive,0.5057238340377808,0.5057238340377808,0.3126789927482605,0.18159720301628113,0.3241,0,1348,0,1
my 1st hd stick,"so i have a 4k stick and it's wonderful. this one was ordered for an older smart panasonic 1080p set and is hd (1080) only. panny has been horrific when it comes to support for its smart tv updates, so i had to buy the stick. lg is is better but they need to do more.overall, i'm very pleased. it's a bit ezier to set up when compared to their 4k stick but both are essentially no-muss, no fuss.what i really like about this stick is the plethora of apps, including a vpn, over and above roku+. we don't have youtube tv yet but i'm hopeful. hulu could use some additional comp.so here's the negative stuff. if u like hulu with live, plan on having to reboot the stick with some regularity. why? there are times when the app it just hangs after the 2nd button press within the hulu app. a reboot will allow one to get directly into hulu forthwith, but subsequent launches result in the hulu profile page displayed first. amazon and hulu need to figure this out.in fairness, i've not experienced this behavior with this hd (not 4k) stick but i rarely use it and suspect that the issue is os based and likely pervasive with multiple versions of the stick.so that's it though! and yes, i can live with that flaw. overall, connectivity is good and for the $$, it's a better choice for me over the roku+",4,185,positive,0.9235758185386658,0.9235758185386658,0.05738629028201103,0.019037945196032524,0.9045,1,1297,0,1
Better than expected,"I am pleasantly surprised that this works so well. I had been looking at the Roku streaming stick+ but it went out of stock, and this was only 30$ instead of $50, so I figured I'd give it a shot.I'm glad I did. Setup was easy, though I was surprised it did not come already linked to my Amazon account like all my other amazon devices have been. It was not a hassle to log in to link them, but it was a step that I didn't expect to take.Logging in to each service was painless, and the downloading of the apps for each non-prime service was quick. I am able to use my 5G wifi band for this, which is a huge bonus.Picture and sound quality are fantastic and I love that the remote takes over my TV, so I don't need to use 2 remotes to operate it.I do wish alexa was better integrated. I don't like having to hold the button down on the remote to speak, as that negates hands-free usefulness. I have an Echo Dot right by our TV and it'd be nice to be able to use that instead of the remote, or to be able to push the remote button once to activate voice, then be able to put it down. It's usually easier for me just to navigate with the remote than try voice commands.Overall though I am very happy and this was better than I expected it to be. Would buy again.",4,186,positive,0.9576215744018555,0.9576215744018555,0.034734196960926056,0.007644277531653643,0.95,5,1259,0,1
Solid Streaming Device,"I now own three of the top streaming devices out there: Apple TV, Roku, and now Fire Stick.The Apple TV is the most robust of the three I'd say in terms of apps and games, and how fast it is and amount of storage. I'd say the Roku would come in second in terms of how snappy it is. Honesty all the devices have all the apps that I could possibly want, so I can't ding any of them for that.What I will say about the Fire Stick is that it's probably the slowest of the three. It's not painfully slow, just not as snappy as my Apple TV or Roku. That being said, it integrates really nicely with Alexa if you have a smart home and are in the Alexa ecosystem, and the stream quality is solid. Also, out of the three devices, this was the cheapest, and goes on sale frequently for like $29, which is a steal. It's not the fastest or most robust streaming device money can buy, but it's also affordable and gets the job done.I feel like I've kind of knocked on it a bit in this review, but really I'm quite satisfied with it considering the price. There are more expensive Fire TV devices like the Cube which has a faster processor and such so I'm sure is much snappier. All that said, when I need another streaming device this will probably be the one I'll buy. Certainly worthy of 4*'s.",4,187,positive,0.8936278820037842,0.8936278820037842,0.09717673808336258,0.009195398539304733,0.8844,0,1281,0,1
Randomly turns off and gets hot **UPDATE 8/6**,"(First one purchased on 5/21/19.) Set up was a breeze, it synced with my TV immediately so the volume buttons worked great. 1 day later, it randomly shut off while watching Netflix. I unplugged it and then it came back on for 2 mins and shut off again. I thought it felt sort of warm, but it was odd as I had only been watching TV for about an hour. I switched to cable for a bit and when I went to turn it on again NOTHING. It would not turn back on. I tried everything from batteries in the remote, switching plugs on the wall and HDMI ports on the TV, even button combinations to manually reset the fire stick. Nothing.I finally unplugged it from the extender, then it came on! But the quality was SOO poor it buffered every 30 seconds, so it still didn't work properly. I have started the return process and plan to order another one once I have my money refunded.I have the 1st generation fire stick and it is doing great! *Knock on wood* I wanted a 2nd stick for the bedroom, so hopefully 2nd time is a charm for this one and I can update this review.**UPDATE! 8/6/2019**2nd firestick works as described! I've had it for about 2 weeks with No issues! Very happy with the new one. The first one I ordered must have been defective, but amazon was quick with the return process.",4,188,positive,0.6125457286834717,0.6125457286834717,0.3674050569534302,0.020049182698130608,0.5925,3,1281,0,1
Does not work with Alexa dot already in the room.,I set this up for me and my parents while I am here taking care of them. I think it is too difficult for my 87 yo parents to operate. Main thing is it does not seem to work with the Alexa dot already in the room. You must use the controller. When I turn on using the controller the tv turns on but stays with the HDMI1 which is the cable input (box is off) so I must have the original TV controller to select the source.I have set up Youtube to look at exercise videos but there is no convenient way to save them to watch later. I have to create lists on the computer before I can use them on the screen.When I have reviewed movies and select one it often tells me I have to have a subscription to another service. I do not want to pay for any more services but there does not seem to be an easy way to set up preferences not to see them.I know this is easy for some but I do not have time to explore. I rely on my innate abilities with computer and this system is not intuitive.The video quality is good and i have not had any problems with loading videos. I also like the watch list so I can pre-select movies for us to watch. I have not figured out how to remove a Thursday night football game I put on my watch list then watched at a friends. I just get an error.,4,189,negative,0.6481680274009705,0.01944171078503132,0.3323902487754822,0.6481680274009705,-0.6287,5,1267,1,0
Nice little streamer.,"I had some courtesy credits from amazon for late deliveries and the only way to redeem them was to purchase an amazon product fulfilled by amazon.This was the closest thing I could find for something I thought I might use. I already have a roku tv and streaming through tivo, but thought this would be handy for taking on vacation since it is so portable, and I really like the remote.After trying it out this weekend, it is a nice little streamer and I like how if you ask alexa something like the weather or a game (I like song quiz) it will put info. And graphics on the tv to see while playing.I also like how I was able to set up the remote to change the volume and channels for the tv and reciever.I thought it was cool to have my bluetooth headphones connect to the firestick, until I realized that somehow it sucks away some of the wi fi bandwidth, and I lost clarity with the picture. There was a warning about this when I tried it. I could have purchased the optional cable to hook directly to the firestick, but I read too many reviews that said that didn't always help. Plus, they should have thrown it in anyway.It's a decent streamer with some nice features, but nothing that really stands head and shoulders above the others in its class and price.",4,190,positive,0.7522647976875305,0.7522647976875305,0.2320038080215454,0.015731386840343475,0.7365,0,1263,0,1
