title,body,rating,review_id,sentiment_label,sentiment_score,positive_score,neutral_score,negative_score,compound_score,topic_id,review_length,is_negative,is_positive
Trash. Absolute Trash. Get a Roku,"This product is absolutely horrid. I mean it streams, but that's about it. Sometimes it doesn't even do that without freezing and glitching. The user interface is garbage and is, like all other Amazon products, extremely centered around generating maximum ad revenue. To top it off, the home screen constantly bombards you with those ads and are constantly encouraging you to spend more money through Amazon. We get it. You want more of our money. We don't have to be reminded that we're all economic slaves to corporate greed and monopolies when we're just trying to get to an app and watch a movie.The greed and control coming from these mega corporations is absolutely ridiculous. You can't watch a 30 second video FB without having to sit through their ad. You can't watch a video on youtube without their ads. And with Amazon, you can't even watch a movie on apps or switch through apps on the home screen without first having to navigate through the heavy home screen advertisements that take up most of the screen. This is extremely frustrating for my elders who have bought a fire sticks and aren't the most tech savvy. They often end up accidentally clicking on the ads, get lost, and have to start over. I have 11 aunts and uncles. I've switched or introduced at least 7 of them to Roku. Most liked them so much that they now have several Rokus for multiple rooms.They bought a Roku and their tech problems were solved. The Roku navigation is cleaner, simpler, the remote responds better (granted it does feel a little cheaper), Roku is constantly improving their voice command feature, their advertisements are only a small section of the home screen, the amount of apps and streaming platforms that you can download on Roku is massive since it isn't hindered by Amazon's need to nickle and dime everyone from customer to seller on everything. Most of all, I've never had a Roku glitch on me. The fire stick streams, and that's why I gave it two stars instead of one. Other than that, it's terrible and I've had nothing but hassle with it, for myself and my elder relatives. Save yourself the money, the headache, and the aggravation. I would suggest getting yourself a Roku streaming device instead.PS. The Roku remotes aren't as much as just buying a new device like the Fire Stick remotes are.",2,54,negative,0.9233772158622742,0.00828058086335659,0.06834208965301514,0.9233772158622742,-0.9151,3,2307,1,0
Audio dropouts make this unusable for me,"My wife purchased this on Prime day. for a very good price.My system: 40 inch Toshiba HDMI tv from 2010, Bose surround sound with JVC receiver, 100 mpbs internet connection. Sound goes from TV to the receiver via Optical cable. My current streaming device is connected via Ethernet and also has its own optical cable to the receiver and does Dolby digital.Plus: The fire stick identified my TV correctly and allowed me to pick the brand of receiver. The remote controls the sound on the receiver. The switch seems to turn off all devices. Alexa integration worked fine and was setup correctly without going into the Alexa app. Some of the apps are better than the apps on my original streaming device, for example Philo TV has a couple of days you can scroll to on the Guide, where my other Streamer only has 7 hours at best. It has a browser; I thought this was cute kind of like WebTV in the old days.Minus: The Home display is very busy; many of my apps appear on multiple places on the home screen. The most recent list seems to add everything to the front. The biggest issue is the LIVE TV band. Why you would waste processor time on this is beyond me. If I want to watch live TV I’ll go into my app for live TV. Pass thru audio seems to be sending Stereo instead of surround sound. I could live with Stereo for my second device. The only thing that does surround sound is Prime and Netflix anyway.But Audio drops outs are the big issue for me. This seems to do pass thru from the HDMI cable into the TV and then down to the receiver via the Optical cable, but every minute or so the sound cuts out. I have tried changing the audio on the fire stick to Stereo, tried different HDMI ports, and tried different setting on the TV as well with no success. I can’t even get it to play a whole song from Prime music without the sound cutting out. This makes it unusable for me. Guess I will be sticking to my other streaming device. I have four of the other brands devices from the basic stick to the Ultra and have no issues with sound via the pass thru. So if you have an older TV with toslink cables/ coax cable for 5.1 surround sound I’d skip this one.",2,55,positive,0.7829583287239075,0.7829583287239075,0.21198482811450958,0.005056802649050951,0.7779,2,2155,0,1
Has trouble connecting brand new and weeks later,"I went with this firestick as i wanted to try something different from the Roku streaming devices. I do enjoy the interface but there are some things about the firestick that really bother me. First it took forever for the device to sync with the Amazon servers - saying there is an issue with the ISP. I work for an ISP so to place blame on the internet provider is not cool (had this issue with Amazon Echo also). Just to paint the picture my access point for this fire stick is literally like 3 ft away from this and won't connect...yet my laptops, phones and other devices have no issues accessing the internet? I tried from a different access point and still no luck (both 5g and 2.4g networks) so the initial setup was not the most seamless. I was surprised to find out I have the same issue a few weeks later when it decided to disconnect on it's on.I use this mainly to stream music only, no video but a device like this suits my needs. As I have several AP's around my house to cover my area with Ethernet capabilities at all locations. Of course Ethernet is not incorporated into this device (you can purchase one but i did not based on the reviews). I would have like to see at least a hard line connection included with this but I am not going to spend extra money for something I use about once per week.The other flaw that I have discovered in the interface is the Alexa integration with premium services (Spotify) when i first linked my account it had no problem opening the application and launching was was commanded...I thought this was really neat at first until I literally tried again and there was a message more or less - Be sure your services are linked with your amazon/alexa account to enable this feature. Of course when I went in to verify if the accounts are linked they were there and set up properly. This completely debunks anything I would use voice commands for.Take it with a grain of salt as i do honestly believe for the price point of the device, it is a great deal and product. Just be prepared to ""Call your ISP"" when the only device not working in my entire home are amazon devices",2,56,negative,0.5756179094314575,0.10106022655963898,0.3233218491077423,0.5756179094314575,-0.4746,0,2122,1,0
Maybe I am the only person who prefers the previous generation firestick.,"I am probably one of the few people who prefers the previous generation firestickI have multiple rooms in my house, each has a television and firestick in each room. My first two devices are the previous generation sans alexa voice control. My second set are new generation units. I continually have the two new units prompting me to allow alexa to control all of my devices. I AM NOT INTERESTED IN THIS. I DO NOT WANT THIS. I WILL NOT DO THIS. This is why I do not own anything with alexa or siri implanted in it. If there is anyway to disable Alexa on the new generation units please post how to do so. I own these for how they can be customized. Since my original purchase I have come to love the firestick. I was able to cut the cord as many people are doing today saving TONS on cable bills.The most frustrating part both the new units had was during set up, the volume control function. BOTH of my new units buffered for extended periods of time. The first of the new units(firestick number 3) took almost an hour to sync then progressed and allowed me to finish set up. The second(firestick number 4) continued to buffer for hours. I actually left it on low volume thru the nite and when I woke up it was still buffering and playing the ""elevator music"" as it tries to sync to allow the remote to control the volume. I do not know if this is an individual defect but having both devices I purchased experience problems really bothers me. Also the multiple steps needed to register the new devices before completion really are annoying. My original devices did not require the multiple steps.Once I was able to get past the delays, and able to configure my devices the way I prefer I have found they are more or less operating as they should. My other pet peeve is just like my mobile device, certain apps are not able to be removed. They are taking up more room on the device that could otherwise be used for content I want.I personally hope Amazon brings back the previous generation firesticks. If they do I will DEFINITELY BUY THEM.Once I was able to complete set up and",2,57,neutral,0.5905582904815674,0.1799187809228897,0.5905582904815674,0.22952300310134888,-0.0496,2,2080,0,0
Support is not all that spectacular. Service is lacking. Price is attractive.,"Update: this device is okay for streaming Netflix. It does not work well with others to including Amazon Prime Videos (regularly choppy, regularly loses continuity between audio and video). I have 3 of these in my home two located within a few feet of Wi-Fi with +500Mbps, and even they drop off or lose connectivity with the network frequently. I would strongly recommend spending you money on a device that functions well as a streaming device. This just isn’t it. Terrible rating for everything except set-up.Bought one during Amazon Day for a low cost option to ease the streaming use of my gaming console. Arrived in a box carefully guarded by many pillows of air within a larger box. Plugged it in, got to working right away. Downloaded apps to stream with, signing into the various apps with each credential set as required. Had some fuzzy streams here and there, no biggie. Moved it a lesser utilized 5G Wi-Fi and fuzzy streams are less common. Moved it from the bedroom to the living room TVs a few times, no problems.Purchased a second stick at regular retail price a few months later. This time it was shipped in a poorly sealed bubble envelope. The package arrived without any sign of merchandise. After nearly two weeks of waiting for my account to be credited, I ordered another stick. This arrived in the same sort of packaging as the first. I plugged it up and hooked it in, got to downloading, repeating all of the steps of the first one. All seems to go smoothly. Remained up touched from Wednesday until Saturday evening. Now it flashes a sort of start screen consisting of the Amazon logo then dies. Called support and was asked to remove the extender and try different HDMI ports. Nothing of the troubleshooting solved the issue. Support said they will email a return shipping label for me to print off and attach to a packaging for the return of the fire stick. It will be tested and evaluated by their technicians. After their evaluation, they will return that stick or a new one. End of story for now.",2,58,negative,0.605087399482727,0.07816445082426071,0.31674817204475403,0.605087399482727,-0.5269,0,2025,1,0
Doesn't work with Disney Plus - get the 4K version or a Roku instead to use Disney Plus,"Netflix and Prime run great so it those are your primary services and don't plan on ever using Disney you'll be fine. But be warned Disney Plus can't run on this version of the Firestick. After installing the app and signing in, the app progress spinner just spins and spins and then the app times out with an network connection error. We tried a number of fixes like resetting the router, re-installing the app, resetting the Firestick etc. Let's face it, a streaming device built in 2020 shouldn't require those levels of work around just to get super popular app to run on the device in the first place. While this could be a problem with the Disney app, Amazon testing should have caught this and simply blocked D+ as an eligible app on this version or worked with Disney to get it fixed. We also have a 4K Firestick and Disney Plus runs like a dream on it. I deeply regret not buying another of those devices rather than this one and really glad we got this on sale as we didn't waste too much money on it. What's a bit more alarming is that there are reviews where folks report success running Disney Plus on this device which made us think we'd be okay. Perhaps this version of the Firestick has inconsistent network internals - so maybe you'll get lucky if you buy a ""good"" one, but you are rolling the dice. Also frustrating is that we have a 4 year old Roku that runs Disney like champ, so no idea what's going on with this Firestick. Bottom line, if you want Disney go with the 4K version or Roku. Another suggestion I've heard for a fix is using hard wired Ethernet and the adapter, but seriously if a Firestick sitting in the same room with our wireless router that happily delivers over 100mps to every other wireless device in the room can't use that bandwidth to make Disney Plus work something is very wrong with the device. For example I can hold my IPad up next to the Firestick and Disney Plus starts right up and streams wonderfully. In fact it even runs fine on our 8 inch Fire tablet. Sigh.",2,59,positive,0.5032341480255127,0.5032341480255127,0.36949363350868225,0.12727218866348267,0.376,3,2013,0,1
Wifi Issues are not your internet,"It is unbelievable that no one will admit that this device has connectivity issues. No one has been able to offer a solution for those whose internet is fine. Replies by ""experts"" and those who claim to know how to troubleshoot this problem seem to offer the same stock answers and ignore what users are ACTUALLY saying about their individual experiences. If anyone trying to troubleshoot the issuewho claims to have any sense at all, they would STOP telling people to check their internet connection. 90 percent of the complaints claim their internet connection is fine because ALL their other devices have NO issues. How hard is that to understand. IT IS THE FIRESTICK that has connectivity issues. If another person tells some poor soul to check their internet connwction,I swear...I dare someone to actually give a real solution (BAR DOING A HARDWIRE) to this problem besides telling people to disable features, restarting the firestick or modem or any other solution that totally ignores the fact that most people with this issue have NO, I repeat, for those who are hard of comprehending, NO issues ALL other devices. And in case someone was wondering, I did try putting it closer to the router and also using HDMI extension cable. Oh yes. Checked my speed, too. It jumps up and down dramatically causing the buffering issue. AGAIN, for those hard of comprehension, not my internet because all other devices maintain a good connection. Again, If someone has a real solution to the Wi-Fi issue...UPDATEI had to order the adapter tyo hardwire it. Now it streams flawlessly. The Wi-Fi, on this device only, fluctuated in speed so bad it will never be adequate. Bottom line- if your internet connection is not 100mbps or higher, in my estimation, your Wi-Fi will connect at half that or less and then add in the throttling (fluctuating the speed) and you will get buffering. Sad that it took me hours of reading reviews and scouring the internet get the whole picture-no pun intended.",2,60,negative,0.891815185546875,0.008284196257591248,0.09990061074495316,0.891815185546875,-0.8835,2,1986,1,0
Disappointed with app selection and streaming sports,"After thinking about purchasing a Fire Stick for a while, I was given one as a gift. I can safely say that I'm happy I didn't spend my own money on one. It may be a lot better with Alexa, but I don't have Alexa.The first thing I did was add the NHL app. The Fire Stick had issues with streaming the games. They were relatively clear but the Fire Stick is unable to maintain the resolution during game action. The problem with that is obvious. By comparison ROKU and cable TV are both able to maintain clarity throughout the action.I checked out some movies and some Amazon shows to see how they faired. They looked great, but since my cable TV has the Amazon Prime Video app, it makes the Fire Stick unnecessary.What I needed a streaming device for was to run apps that aren't available through my cable. I wanted to try Fire Stick because I have another nearby TV on ROKU. Another ROKU would only cause cross signal issues with the remotes. Unfortunately, Fire Stick doesn't allow some of these apps. Most notably VUDU and AMC Theaters On Demand. Amazon seems to think it's fine because I can access the same content through other apps, but in the case of something like AMC Theaters there's the issue of receiving credit towards rewards for AMC Stubs Premiere members such as myself.I also wanted to add the Xfinity beta app because I don't use a cable converter for my other TV. So I'm using my ROKU to stream my cable instead. If Fire Stick would run this app I could switch it to the other TV and use the ROKU on my main TV to stream the other apps Fire Stick won't run.So, as long as Amazon seems to feel it's okay to ask customers to utilize alternatives, I'll continue using ROKU as an alternative to Fire Stick.Fire Stick may deserve more stars. It's a fine streaming device. Maybe it has advantages I'm missing? I don't know. As it is now, for me personally it's a bit of a bust. So I'm giving it 2 stars.",2,61,positive,0.5444190502166748,0.5444190502166748,0.3365074396133423,0.1190735325217247,0.4253,0,1915,0,1
It’s great when it works properly and doesn’t lag,"I purchased this as an upgrade from an older Apple TV and it has made my media experience much more convenient. It is relatively easy to set up to your TV and I like how I can control the power button with one remote. Being able to control the volume is also a great feature, but the buttons to control the volume are not as soft. When the volume fluctuates a lot in a show, I find that I grab my original TV remote to quickly lower the volume.Another issue I’ve had is that when I overuse Alexa, some of the apps don’t function properly. It can be inconsistent sometimes, and I find that apps start working again after you restart the firestick once or twice. The fact that I can connect my cable account and download my favorite channel is huge plus. However, watching Live TV tends to lag sometimes.UPDATE: The automatic sign-in has ruined my experience with this device. I used to be able to watch cable networks by using my TV provider, but ever since I changed my Spectrum password I cannot access programs on cable apps, such as HGTV, MTV, USA or Bravo.I have tried absolutely everything to fix this issue. I signed out of these TV provider apps and tried signing back in but every time I try to do so it just signs me in automatically without giving me the chance to manually type my username or password. I have rebooted my device to the default factory settings. I have deleted these TV provider apps and tried to download it again but it always automatically signs me in. I have even called Amazon Customer Service to ask for help, and when I tried explaining the issue I LITERALLY GOT YELLED AT! When I asked to speak to her supervisor because she had a tone with me, she just redirected me without apologizing for her rude behavior. I have tried everything and I’m not sure what to do because Amazon won’t even help me.",2,62,positive,0.92485111951828,0.92485111951828,0.06901165843009949,0.006137218326330185,0.9187,4,1832,0,1
Disappointing,"We bought our first Fire Stick back on October 8, 2019. It worked so well we cancelled our 20 year relationship with Direct TV. We liked it so much we bought a second one for downstairs within a week. The first one sometimes will lock up and we have to reboot to fix it. I can live with that. We were still very happy with the Fire Sticks and bought another one last week for our daughter's TV. Then a few days ago the second Fire Stick started displaying a warning that the memory was getting full when it was turned on. It suggested deleting one or more APPs to restore some memory. I did that, but when I checked the memory there was no change. Then the warning started popping up while browsing and then while watching a show. This got so irritating that I ended up uninstalling every APP that wasn't factory installed. I rebooted the Fire Stick and still no change in the memory. One of the options on the manage storage screen was to do a Factory Reset that would erase all content and storage on the device except the factory APPs, make it like it came out of the box. OK so I did that. When it started up it asked what language, OK English; then it found my internet connection and I signed on, connection success, so far so good; then Finding Updates, ""Unable to update your Fire TV Stick"" Try disconnecting the power for a few seconds then plug it back in. Did that, didn't work. ""If that does not work contact us at www.amazon.com/devicesupport""Followed the URL to the site and there was no support there, just support sales merchandise: support books, support shelves, support hose, support socks, etc. I had to spend about 20 minutes digging deep into the site to finally get to a Fire Stick device help page but none of the trouble selections came close to fitting my issue.",2,63,positive,0.843943178653717,0.843943178653717,0.13583573698997498,0.02022107131779194,0.8237,3,1788,0,1
"Loved it, remote stopped working after a month.","I usually don’t leave reviews like this, I really want to like stuff and give people a chance but I have to share my experience.Initially we really loved the product, as far as streaming it worked great, we’ve yet to really use the Alexa feature but that’s okay too. The reason for my star rating is after a month our remote stopped working, just completely unresponsive so at first we thought it was batteries and we changed them, then we had to unplug the whole system, change hdmi ports the whole deal.After two weeks of this happening completely randomly (I tried the system on other TVs, ports, with and without hdmi dongle etc), I finally called customer support, they walked me though resetting the remote which worked and then not even an hour later same thing happened completely unresponsive and a black screen (tv still turned on and off just fine), so I called them back, I was on the phone for almost 40 minutes unplugging and replugging the whole system all over the place, opening and closing apps and making them each play a movie for a few minutes to “stress test” the stick, then I was told they would call me back after two hours and to leave a movie playing, they called back same issue so we reset everything and updated, I was told that it was simply because I hadn’t updated that I have this issue and that “it only takes a couple minutes to check so I should do it more” now it’s been two days (no new update) and once again the screen froze and the remote is completely unresponsive I don’t know if it’s just defective or if other people have had this issue.At this point Im so frustrated with the stick and the customer service that I absolutely would not recommend this product, you’re better off without a smart tv than with this.",2,64,positive,0.7295092344284058,0.7295092344284058,0.2079625278711319,0.06252824515104294,0.667,0,1758,0,1
Seriously Amazon...,"Very disappointed with this piece of junk... First of all, you're suppose to get 8G with the stick to download the apps you want, however Amazon takes up 85% of that space with useless garbage they want you to have and there's no way to uninstall it (such as: GameCircle, Amazon Pictures, Amazon Music, Amazon Family Time, etc.) Some people may want that stuff but it should be at the user's choice not forced upon everyone. If this is how Amazon is going to operate then they should re-issue new FireTV Stick's to those who own one with larger storage capacity like 12G or 24G. Second, buffering is horrible. You can't watch anything without it jamming up and stalling, the picture quality if far worse than a pirated copy video/disc as it's out of focus (blurry) most of the time. Called tech support about all these issues and all I got was ""Well that's the way it's set up. Nothing we can do about it."" Amazon and Jeff Bezos had better put the money down they're counting from ripping off subscribers and customers and start paying more attention to their products they're pandering onto the public. Amazon use to be a good, decent company...not anymore. They raise their prices on everything especially their Prime Membership -- which is ridiculous and price gouging -- and they expect people to just fork over their money. They remove their APP from all TVs so you can't have quality viewing anymore and expect you to buy a cheap piece of junk like their FireTV Stick. I'm going to get rid of mine and go to ROKU or some other product. This is all a setup for Amazon and Bezos to ""force"" their next product on the public -- Amazon TVs. Third, as one other reviewer mentioned it is ridiculous what you have to go through to replace the batteries on the cheap remote.",2,65,negative,0.8417473435401917,0.015655381605029106,0.1425972729921341,0.8417473435401917,-0.8261,0,1771,1,0
